780471	ചന്ദ്രൻ ഭൂമിയുടെ ഏക ഉപഗ്രഹമാണ്.	238831	The moon is the earth's only satellite.
781048	എനിക്ക് നീ ചിരിക്കുന്ന രീതി ഇഷ്ടമാണ്.	17051	I like the way you smile.
781052	ഈജിപ്തിലെ പിരമിഡുകൾ ലോകത്തിലെ ഏഴ് അത്ഭുതങ്ങളിൽ ഒന്നാണ്.	682468	The pyramids of Egypt are one of the seven wonders of the world.
781056	ഞാൻ ജപ്പാനിൽ രണ്ട് വർഷം മുമ്പാണ് വന്നത്.	252542	I came to Japan two years ago.
781058	അവസാനം, അവർ ഒരു തീരുമാനത്തിൽ എത്തി.	39858	At last, they came to a decision.
781060	ഇംഗ്ലീഷ് നന്നായി സംസാരിക്കാൻ അത്ര എളുപ്പമല്ല.	52991	It is not easy to speak English well.
781061	വേറെ എന്താണ് നിനക്ക് വേണ്ടത്?	274613	What else do you want?
781066	എനിക്ക് രാത്രി ഉറങ്ങാൻ കഴിയുന്നില്ല.	318679	I can't sleep at night.
781067	അവൾ പുകവലി നിർത്തി.	311562	She stopped smoking.
781070	അവൻ എനിക്ക് ഒരു നല്ല സമ്മാനം തന്നു.	297673	He gave a nice present to me.
781621	അവന് ഗോൾഫ് എങ്ങനെയാണ് കളിക്കുന്നതെന്ന് അറിയില്ല.	289976	He doesn't know how to play golf.
781623	ഞാൻ കുറച്ച് ദിവസത്തേക്ക് പട്ടണം വിടുകയാണ്.	271061	I am leaving town for a few days.
781624	അവൾക്ക് ഈ പൂച്ചകളെ ഇഷ്ടമാണ്.	488218	She likes these cats.
781627	ഞാൻ എന്റെ മാതാപിതാക്കളുടെ കൂടെയാണ് ജീവിക്കുന്നത്.	262220	I live with my parents.
781628	അവൻ ആ മഞ്ഞ വീട്ടിലാണ് താമസിക്കുന്നത്.	294169	He lives in that yellow house.
781629	എനിക്ക് രണ്ട് ക്യാമറകളുണ്ട്.	253340	I have two cameras.
781630	അവൻ ഈ കലാലയത്തിലെ വിദ്യാർത്ഥിയാണ്.	289933	He's a student at this college.
781631	അവൾ വയലിൻ വായിച്ചു.	311946	She played on the violin.
781632	സാൻ ഫ്രാൻസിസ്കോയ്ക്ക് ന്യൂ യോർക്കിന്റെ ജനസംഖ്യയുടെ പത്തിലൊന്ന് മാത്രമേയുള്ളൂ.	53916	San Francisco is only one-tenth as populous as New York.
781633	മഞ്ഞ് കാരണമാണ് സ്കൂൾ അടച്ചത്.	21565	The school's closure was due to the snow.
781634	ഒരു വലിയ നഗരത്തിൽ ജീവിക്കാൻ എനിക്ക് ഒരാഗ്രഹവുമില്ല.	682455	I have no wish to live in a large city.
781635	നീ അത് തീർത്തോ?	16546	Have you finished it?
781636	ഞാൻ അവളുടെ ഫോൺ നമ്പർ എഴുതിയെടുത്തു.	261298	I wrote down her phone number.
781637	ആ വാതിൽ തനിയെ തുറുന്നു.	50210	The door opened of itself.
781638	എല്ലാം നമ്മുടെ തെറ്റാണ്.	42736	It was all our fault.
781639	അവന് എഴുപത് കിലോ ഭാരമുണ്ട്.	435040	He weighs 70 kilos.
781641	അവൻ ക്ലാസ് മുറിയിലേക്ക് ഓടി.	295363	He ran into the classroom.
781642	ഈ കടയിലെ എറ്റവും മികച്ച ക്യാമറ ഇതാണ്.	56166	This is the best camera in the store.
781643	ഞായറാഴ്ച വൈകുന്നേരം നിനക്ക് വരാൻ പറ്റുമോ?	281860	Can you come on Sunday evening?
781644	നാളെ ഇതേ സമയത്ത് മഴ പെയ്യുകയായിരിക്കും.	323167	It will be raining at this time tomorrow.
781645	ഞാൻ ഇംഗ്ലീഷ് പഠിപ്പിക്കുന്നു.	436979	I teach English.
781647	അവൾ പോകുന്നില്ല എന്ന് തീരുമാനിച്ചു.	313598	She decided not to go.
781648	ഞങ്ങൾ മുമ്പ് പാരീസിലാണ് ജീവിച്ചിരുന്നത്.	248412	We lived in Paris before.
781649	എനിക്ക് പണമില്ല, പക്ഷേ എനിക്ക് സ്വപ്നങ്ങളുണ്ട്.	453512	I don't have money, but I have dreams.
781650	എനിക്ക് നീന്തൽ വളരെ ഇഷ്ടമാണ്.	256174	I like swimming very much.
781722	അവൾ എന്റെ മൂത്ത സഹോദരിയാണ്.	314333	She is my elder sister.
781723	എന്റെ വീട്ടിൽ നിന്നും നിന്റെ വീട് വരെ രണ്ട് കിലോമീറ്റർ ദൂരമുണ്ട്.	680720	The distance from my home to yours is two kilometers.
784380	അതെനിക്ക് വിട്ടു തരിക.	321442	Leave it to me.
784405	അവനെ സ്വാധീനിക്കുക എന്നുള്ളത് അസാധ്യമാണെന്ന് ഞങ്ങൾ കണ്ടെത്തി.	307875	We found it impossible to persuade him.
784408	ഞാൻ എന്താണ് ചെയ്യേണ്ടത്?	449699	What should I do?
784416	ഇതാണ് ജാക്ക് പണിത വീട്.	55922	This is the house that Jack built.
784419	അവൻ എപ്പോഴും പഠിച്ചു കൊണ്ടിരിക്കും.	289211	He is always studying.
789013	ഞാൻ മനസ്സിലാക്കാൻ തുടങ്ങുന്നു.	29197	I am beginning to understand.
789016	അവർ ഒരേ സമയം ചിരിക്കുകയും കരയുകയും ചെയ്തു.	306874	They laughed and cried at the same time.
789019	വെള്ളമില്ലാതെ ജീവിക്കുന്നത് അസാധ്യമാണ്.	270769	It is impossible to live without water.
789021	അവൻ കുതിരപ്പുറത്ത് നിന്ന് താഴെ വീണു.	302383	He fell off the horse.
789022	കാലാവസ്ഥ എപ്പോഴും മാറിക്കൊണ്ടിരിക്കും.	464470	Weather changes often.
789024	ആരോ എന്റെ ബാഗ് മോഷ്ടിച്ചു.	689932	Someone stole my bag.
789025	ഏതാണ് ആദ്യം വന്നത്, കോഴിയോ അതോ മുട്ടയോ?	623300	Which came first, the chicken or the egg?
789026	ആ വീട്ടിൽ രണ്ട് കുടുംബങ്ങൾ താമസിക്കുന്നു.	68550	Two families live in that house.
789096	നാളെ മഴ പെയ്യുകയാണെങ്കിൽ മത്സരം ഉപേക്ഷിക്കും.	30588	The game will be called off if it rains tomorrow.
789098	നീ ഈ പുസ്തകം അവന് തിരിച്ചു നൽകണം.	16571	You must return the book to him.
789565	എനിക്ക് നിന്നെ ഇഷ്ടമാണ്.	410751	I like you.
789566	എനിക്ക് രണ്ട് സഹോദരന്മാരും ഒരു സഹോദരിയും ഉണ്ട്.	453869	I have two brothers and a sister.
789567	എനിക്ക് ആദ്യം അവനെ തിരിച്ചറിയാൻ കഴിഞ്ഞില്ല.	28963	I couldn't recognize him at first.
789568	അവൻ ഒരു കത്തെഴുതി.	452751	He wrote one letter.
789569	ഈ മേശ തടി കൊണ്ട് ഉണ്ടാക്കിയതാണ്.	60865	This table is made of wood.
789570	അവന്റെ പ്രസംഗത്തിന്റെ ഉള്ളടക്കം വളരെ നല്ലതായിരുന്നു.	285361	The content of his speech was very good.
789584	എനിക്ക് ഒരു പുതിയ സൈക്കിൾ വേണം.	269174	I need a new bicycle.
789585	ഞാൻ ആരാണെന്ന് നിനക്കറിയില്ല.	1762	You don't know who I am.
789586	നീ ഞാൻ പറഞ്ഞത് കേൾക്കണമായിരുന്നു.	1726	You should have listened to me.
789588	ഞാൻ ഇന്ന് മുതൽ പുകവലിക്കില്ല.	542899	I won't smoke from today on.
790023	ആ കാർ എന്റേതാണ്.	68276	That car is mine.
792900	കൊതുകുകൾ കാരണം ഞങ്ങൾക്ക് ജനാല അടയ്ക്കേണ്ടി വന്നു.	464386	We had to shut the window because of the mosquitoes.
792901	എനിക്ക് എന്റെ താക്കോൽ നഷ്ടപ്പെട്ടു.	460058	I lost my key.
792902	അവൾ സ്പൂൺ കൊണ്ട് സൂപ്പ് ഇളക്കി.	311030	She stirred the soup with a spoon.
792906	നീ എങ്ങനെ നിന്റെ അവധിക്കാലം ചെലവഴിച്ചു?	19794	How did you spend your vacation?
794024	ആരാണിത് പൊട്ടിച്ചത്?	54973	Who broke this?
794030	കാൽപ്പന്താണ് എനിക്ക് എറ്റവും ഇഷ്ടമുള്ള കളി.	449651	My favourite sport is football.
794068	ഞങ്ങളുടെ ക്ലാസ്സിൽ നാൽപ്പത് വിദ്യാർത്ഥികളുണ്ട്.	506898	There are forty students in our class.
794069	മഴവില്ലിന് ഏഴ് നിറങ്ങളുണ്ട്.	281035	The rainbow has seven colors.
794072	അവൾ ഒരു ധനികനായ വ്യാപാരിയെ വിവാഹം ചെയ്തു.	313321	She married a rich merchant.
794239	അവൾ ഇപ്പോൾ വീട്ടിൽ നിന്ന് പുറപ്പെട്ടതേ ഉള്ളൂ.	313696	She left home just now.
794240	അവൻ മൂന്ന് മണിക്കൂർ കഴിഞ്ഞ് വീട്ടിൽ തിരിച്ചെത്തി.	288541	He came home three hours later.
794244	ഞാൻ യുദ്ധത്തിനെതിരെയാണ്.	762691	I'm against the war.
794245	ഞാൻ രണ്ട് ദിവസം മുമ്പ് അത് നിനക്ക് അയച്ചു.	680125	I sent it to you two days ago.
794247	ഈ പുസ്തകത്തിൽ കുറെ ചിത്രങ്ങളുണ്ട്.	57085	This book contains many pictures.
798487	ഈ കായലിൽ വളരെയധികം മത്സ്യങ്ങളുണ്ട്.	467691	There are many fish in this lake.
800318	എനിക്ക് ഉറപ്പാണ്.	436433	I am sure.
808261	അത് നിന്റെ കത്തിയല്ല.	42814	That is not your knife.
817283	ഞങ്ങളുടെ കൂടെ വരൂ.	433695	Come along with us.
817283	ഞങ്ങളുടെ കൂടെ വരൂ.	433696	Come with us.
817298	അവൻ ജപ്പാനിലേക്ക് എന്നെങ്കിലും ഒരിക്കൽ തിരിച്ചു പോകും.	289025	He will return to Japan some day.
817302	ആരും മറ്റുള്ളവരെ കുറിച്ച് മോശമായി സംസാരിക്കാൻ പാടില്ല.	274750	One should not speak ill of others.
817304	അവനും ഞാനും അദ്ധ്യാപകരാണ്.	284475	He and I are teachers.
817306	ഞാൻ നാളെ പാരീസിലേക്ക് പുറപ്പെടും.	252662	I leave for Paris tomorrow.
817307	വളരെ തണുപ്പായതിനാൽ ഞാൻ പുറത്തു പോയില്ല.	37812	I didn't go out because it was very cold.
817310	ഈ നിഘണ്ടു എന്റേതല്ല.	750879	This dictionary isn't mine.
818982	നിനക്ക് എന്തു ചെയ്യാനാണ് ഇഷ്ടം.	464544	What do you like to do?
820033	എനിക്ക് ഇന്ന് ഇംഗ്ലീഷ് പഠിക്കാൻ തോന്നുന്നില്ല.	242778	I don't feel like studying English today.
820037	ദൈവത്തിന് മുമ്പിൽ എല്ലാ മനുഷ്യരും തുല്യരാണ്.	51726	All men are equal before God.
820052	അവർ നിനക്ക് വേണ്ടി അത് ചെയ്യാൻ തയ്യാറാണ്.	305468	They are willing to do it for you.
820225	അമ്മയാണ് എന്നെ ഞാനാക്കിയത്.	320782	Mother has made me what I am.
820233	ഇന്ന് സ്വാതന്ത്ര്യദിനമാണ്.	480228	Today is Independence Day.
822223	ഇതൊരു തടിമേശയാണ്.	389014	This is a wooden table.
822224	അവൻ ഇവിടെ മാസത്തിലൊരിക്കൽ വരും.	292565	He comes here once a month.
891371	അത് തൊടരുത്	433652	Don't touch it.
891372	അനുവാദമില്ലാതെ മുറിയിൽ പ്രവേശിക്കരുത്.	525744	Don't enter the room without permission.
924864	അതൊരു ചുവന്ന പേനയാണോ?	756497	Is that a red pen?
950153	അടുത്ത വ്യാഴാഴ്ച ഒരു അവധിദിവസമാണ്.	922251	Next Thursday is a holiday.
950158	ഈ മരം വളരെ പെട്ടെന്ന് വളരും.	43797	The tree grows very quickly.
950161	നിന്റെ സഹോദരനെവിടെയാണ്?	873552	Where is your brother?
1055638	എനിക്ക് അഞ്ച് ദിവസത്തെ സമയം തരൂ.	72493	Give me five days.
1055639	ഞാൻ ഈ തെറ്റിനുള്ള വിശദീകരമണം ആവശ്യപ്പെടുന്നു.	58679	I demand an explanation for this mistake.
1233111	ഇത് തണുത്തതല്ല.	392279	This is not cool.
1233112	അവന്റെ ഇടതുകൈ കൊണ്ട് അവൻ പന്ത് പിടിച്ചു.	296677	He caught the ball with his left hand.
1247012	എന്നെ നാളെ വന്നു കാണൂ.	323473	Come and see me tomorrow.
1776820	എല്ലാവർക്കും തെറ്റുപറ്റും.	354852	Everyone makes mistakes.
1776822	കൊള്ളാം! നിങ്ങൾ ഈ ചിത്രം നന്നായി വരച്ചിട്ടുണ്ട്.	1098783	Well done! You have drawn this picture nicely.
1776823	വെള്ളമല്ലാതെ മറ്റൊന്നും കണ്ടില്ല.	270865	Nothing was to be seen but water.
1776824	എന്തെങ്കിലും കുടിക്കാൻ വേണമോ എന്ന് ടോം മേരിയോട് ചോദിച്ചു.	1029713	Tom asked Mary if she wanted something to drink.
1776825	എന്റെ വസ്ത്രങ്ങൾ അവിടെയാണ്.	1635411	My clothes are there.
1776826	ഞങ്ങൾ നിയമങ്ങൾ അനുസരിച്ചു.	23202	We obeyed the rules.
1776827	ഗോൾഡൻ ഗേറ്റ് ബ്രിഡ്ജിന്റെ നീളം എത്രയാണ്?	18489	How long is the Golden Gate Bridge?
1776829	അതൊരു വയസ്സായ സ്ത്രീയുടെ ശബ്ദമാണ്.	1125171	It's the voice of an old woman.
1776830	ഇങ്ങനെയാണ് ആ അപകടം നടന്നത്.	60391	This is how the accident happened.
1776831	മൂന്ന് ലക്ഷം യെൻ ആണ് എന്റെ പ്രതിമാസ ശമ്പളം.	1152403	My monthly salary is 300,000 yen.
1776832	നിനക്ക് ടെന്നീസ് കളിക്കാൻ ഇഷ്ടമാണോ?	39404	Aren't you fond of playing tennis?
1776833	അലൻ ഒരു കവിയാണ്.	607736	Alan is a poet.
1776834	ടോം മാംസവും മുട്ടയും കഴിക്കാറില്ല.	1026197	Tom doesn't eat meat or eggs.
1776835	നൂറ് വരെ എണ്ണൂ.	1624935	Count to one hundred.
1776837	അവൻ ഇപ്പോൾ ഒരു പുസ്തകം എഴുതുകയാണ്.	296637	He's writing a book now.
1776838	ദയവായി ഇവിടെ കാത്തിരിക്കൂ.	61875	Please wait here.
1776839	ഇതെന്റെ നായയാണ്.	983943	This dog is mine.
1776840	എന്റെ മാതാപിതാക്കൾ രണ്ടുപേരും ഇപ്പോൾ വീട്ടിലുണ്ട്.	252088	Both my parents are at home now.
1776841	എത്ര മണിക്കാണ് അപകടം നടന്നതെന്ന് നിനക്കറിയാമോ?	68313	Do you know what time that accident happened?
1776842	നീ ഇന്നലെ സ്കൂളിൽ പോയോ?	69389	Did you go to school yesterday?
1776843	എന്റെ വീട്ടിൽ നിന്ന് ഇറങ്ങിപ്പോകൂ!	1224050	Get out of my house!
1776844	എന്റെ വാക്കുകൾ തെറ്റിദ്ധരിക്കരുത്.	1311889	Don't misunderstand my words.
1776845	നമുക്ക് ക്ഷമിക്കാനാകും, പക്ഷേ മറക്കാൻ അസാധ്യമാണ്.	1303184	We can forgive, but forgetting, it's impossible.
1776846	ആ പൂച്ച എന്റെ കൈയിൽ മാന്തി.	282056	The cat scratched my hand.
1776849	ഞാൻ ഒരു അമേരിക്കക്കാരനല്ല.	831636	I'm not an American.
1776851	ഞാൻ ചിലപ്പോൾ അത്താഴം പാകം ചെയ്യും.	258163	I sometimes cook dinner.
1776852	പഞ്ചസാര വെള്ളത്തിൽ അലിയുന്നു.	243599	Sugar dissolves in water.
1776854	ഈ അയൽപ്പക്കത്തെ ഏറ്റവും വലിയ വീടാണത്.	1611164	It's the biggest house in the neighborhood.
1778131	ഞാൻ ഒരു ഡോക്ടറാണെന്ന് അവൾ വിചാരിച്ചിരുന്നു.	492633	She thought that I was a doctor.
1778132	എന്റെ സഹോദരൻ ഒരിക്കലും ഫുജി കൊടുമുടി കീഴടക്കിയിട്ടില്ല.	251523	My brother has never climbed Mt Fuji.
1778133	അവളുടെ അച്ഛൻ മരിച്ചു.	874943	Her father died.
1778134	ഈ ക്ലാസ്സിൽ നാല്പത് കുട്ടികളാണുള്ളത്.	61184	This class consists of forty pupils.
1778135	അടുത്ത ഞായറാഴ്ച നീ എന്റെ വീട്ടിലേക്ക് വരില്ലേ?	242334	Won't you come to my house next Sunday?
1778136	അതൊരു ഹിന്ദി ചലച്ചിത്രമാണ്.	1663115	It's a Hindi movie.
1778137	ഞാൻ അവരോട് മുറി വിട്ട് പോകാൻ കല്പിച്ചു.	260844	I ordered them to leave the room.
1778138	ഞാൻ തിരിച്ചുവരും.	261982	I'll come back.
1783285	ഈ രണ്ട് ചിത്രങ്ങൾ തമ്മിലുള്ള വ്യത്യാസം നീ കണ്ടുപിടിച്ചോ?	406243	Did you find the difference between these two photos?
1915913	അവൻ എന്നോട് നൃത്തം ചെയ്യാൻ ആവശ്യപ്പെട്ടു.	1745630	He asked me to dance.
1915915	അവന് എന്റെ ഇരട്ടി പ്രായമുണ്ട്.	288157	He is twice as old as I.
2186763	രണ്ടു തവണ അളക്കൂ, ഒരു തവണ മുറിക്കൂ.	1495693	Measure twice, cut once.
2186777	മഴ പെയ്തില്ലായിരുന്നെങ്കില്‍ ഞാന്‍ വന്നേനെ.	2186518	I should have come if it hadn't rained.
2186944	അതുപോലൊരു അപകടം വീണ്ടും ഉണ്ടാകാന്‍ സാധ്യത ഉണ്ട് .	51214	Such an accident is likely to happen again.
2186960	കേള്‍വിക്കാര്‍ അവനെ കൈകൊട്ടി അഭിനന്ദിച്ചു, അതായതു അവന്റെ പ്രകടനം വിജയിച്ചു.	277945	The audience applauded him, which means his performance was a success.
2186993	അവള്‍ക്ക് ലോകവിവരം ഇല്ലായിരുന്നു.	315298	She is ignorant of the world.
2187042	അവന്‍ കടല്‍മാര്‍ഗം വന്നു പക്ഷെ വായുമാര്‍ഗം തിരിച്ചുപോയി.	2186908	He arrived by sea but left by air.
2187053	ഇതാണ് ഫിന്ലാണ്ടിലെ ഏറ്റവും വലിയ വൈദ്യുതിനിലയം.	2186880	This is Finland's biggest power station of all.
2187058	ചോദ്യങ്ങള്‍ ഇതുവരെ ആരെയും വേദനിപ്പിച്ചിട്ടില്ല.	2186856	Questions never hurt anyone.
2187059	ഞാന്‍ ആറു മണിയോട് അടുപ്പിച്ചു വന്നു.	2186522	I came at about six.
2187064	ജോലി കഴിയുന്നതിനു മുന്‍പേ എനിക്ക് പോകണമെന്നില്ല.	2186513	I didn't want to leave before the work was completed.
2187079	ഇപ്പോള്‍ എനിക്ക് എന്ത് വേണമെന്ന് എനിക്കറിയില്ല.	2186494	I don't know what I want right now.
2187080	ഇത് നല്ല മാംസം ആണ് .	57556	This is good meat.
2187083	എനിക്ക് സ്ത്രീകളെ ഇഷ്ടമാണ് .	2186489	I love a woman.
2187089	നമ്മള്‍ തമ്മില്‍ സംസാരിക്കണം എന്ന് ഞാന്‍ വിചാരിക്കുന്നു.	2186487	I think we should talk.
2187093	ആരെ ആണ് നിങ്ങള്‍ വിശ്വസിപ്പിക്കാന്‍ ശ്രമിക്കുന്നത് ?	2186473	Who are you trying to convince?
2187179	എന്നാല്‍ ചെയ്യാന്‍ കഴിയുന്നതൊക്കെ ഞാന്‍ ചെയ്യും.	244079	I will do my best.
2187322	നിങ്ങള്‍ തെറ്റിദ്ധരിച്ചു.	2187275	You've misunderstood.
2187323	നിങ്ങള്‍ പരാജയപ്പെട്ടു.	2187274	You've failed.
2187325	ടോം മനസിലാക്കി.	2187273	Tom understood.
2187326	ടോം നിലവിളിച്ചു.	2187272	Tom screamed.
2187328	അത് വിവേകപരം ആണ് .	2187271	That's wise.
2187343	അത് അസത്യമാണ് .	2187269	That's untrue.
2187346	അത് അവളുടെതാണ് .	2187267	That's hers.
2187349	അത് അവന്റേതാണ് .	2187266	That's his.
2187350	അത് ടോമിന്റെതാണ് .	2187265	That's Tom's.
2187352	അത് അവളാണ് .	2187264	That's her.
2187353	അത് അവനാണ് .	2187263	That's him.
2187354	അത് പര്യാപ്തമാണ് .	2187262	That's sufficient.
2187358	അത് പരിഹാസ്യമാണ് .	2187261	That's ludicrous.
2187366	അത് മനോഹരമാണ് .	2187260	That's lovely.
2187369	അത് യുക്തിസഹമാണ്.	2187259	That's logical.
2187372	അത് വിനോദമാണ്‌ .	2187258	That's fun.
2187375	അത് മണ്ടത്തരമാണ് .	2187257	That's foolish.
2187377	അത് സ്പഷ്ടമാണ് .	2187256	That's evident.
2187381	അത് സംശയകരമാണ് .	2187255	That's doubtful.
2187383	അത് ശരിതന്നെ.	2187254	That's alright.
2187388	അത് അംഗീകരിക്കാവുന്നതാണ് .	2187253	That's acceptable.
2187392	പതുക്കെ ചെയ്യൂ.	2187252	Slow down.
2187400	കുറ്റം പറയുന്നത് നിര്‍ത്തു.	2187251	Quit complaining.
2187403	ശ്രദ്ധാപൂര്‍വ്വം കേള്‍ക്കു.	2187250	Listen closely.
2187404	നമുക്ക് പ്രാര്‍ത്ഥിക്കാം.	2187249	Let's pray.
2187405	ഇത് നിങ്ങളുടെതാണ്.	2187248	It's yours.
2187427	നമുക്കിവിടെ ബേസ് ബോള്‍ കളിയ്ക്കാന്‍ സാധിക്കില്ല.	61924	We cannot play baseball here.
2188414	ഞാന്‍ ചെയ്തു കഴിഞ്ഞിരിക്കുന്നു.	1308819	I'm already done.
2188415	പുഷ്പം വസന്തത്തിന്റെ തുടക്കത്തില്‍ ആണ് വിരിയുന്നത് .	49206	The flower comes out in early spring.
2188416	കാര്‍ അവരുടേതാണോ എന്ന് ഒരു പോലീസുകാരന്‍ പെണ്‍കുട്ടികളോട് ചോദിച്ചു.	825472	A policeman asked the girls if the car was theirs.
