2188418	നാളെ നമ്മള്‍ ശത്രുക്കളുമായി ഏറ്റുമുട്ടും.	323395	Tomorrow we will encounter the enemy.
2188419	അവന്‍ എല്ലാദിവസവും ഇവിടെ വരാറില്ല.	303894	He does not come here every day.
2188420	ജാപനീസ് ഗൃഹങ്ങളില്‍ നിങ്ങളുടെ പാദരക്ഷകള്‍ അഴിക്കുക.	281343	Remove your shoes in a Japanese house.
2188421	ടാക്സി വാടക അടുത്ത മാസം കൂടും.	325028	Taxi fares will go up next month.
2188422	ഞങ്ങള്‍ ആറ് വര്ഷം ഒസകയില്‍ താമസിച്ചിരുന്നു.	262680	We have lived in Osaka six years.
2188424	സഞ്ചി എനിക്ക് വഹിക്കാന്‍ കഴിയുന്നതിനെക്കാള്‍ ഭാരമേറിയതായിരുന്നു.	48892	The bag was too heavy for me to carry by myself.
2188426	രണ്ടു കാര്യങ്ങള്‍ ഒരേസമയം ചെയ്യാന്‍ ശ്രമിക്കരുത് .	27468	Don't attempt two things at a time.
2188427	എല്ലാവര്‍ക്കും തങ്ങളുടെതായ ശക്തിയും ദൗര്‍ബല്യങ്ങളും ഉണ്ട് .	276472	Everyone has their own strong and weak points.
2188428	ഞാന്‍ സന്തോഷത്തോടെ നിങ്ങളെ സഹായിക്കാം.	20664	I will gladly help you.
2188429	ഞാന്‍ ആ കത്ത് എഴുതാം എന്ന് സമ്മതിച്ചു.	1798945	I agreed to write that letter.
2188437	ഞാന്‍ ശരിക്കും തളര്‍ന്നു.	433727	I'm really tired.
2188439	നിങ്ങള്‍ ഏതു വര്‍ഷം ആണ് ജനിച്ചത്‌ ?	509620	What year were you born?
2188444	എനിക്ക് വാക്ക് എങ്ങനെ സ്പെല്ല് ചെയ്യണം എന്ന് അറിയില്ല.	254335	I don't know how to spell the word.
2188445	ലണ്ടന്‍ പല തവണ ബോംബ്‌ ചെയ്യപ്പെട്ടു.	29267	London was bombed several times.
2188446	ഇത് എല്ലാവരാലും എളുപ്പത്തില്‍ മനസിലാക്കപ്പെടാന്‍ കഴിയുന്നതല്ല.	51738	It is not easy to be understood by everybody.
2188684	അവന്‍ ദയയില്ലാത്തവന്‍ ആണ്.	2188430	He's ruthless.
2188685	അവള്‍ ദയയില്ലാത്തവള്‍ ആണ്.	2188431	She's ruthless.
2188687	അവള്‍ നല്ല ഒരു പാചകക്കാരി ആണെന്ന് തോന്നുന്നു.	2188385	She seems to be a good cook.
2193214	ചിന്തയുടെ കാട്ടുതീയില്‍, ആത്മനാശത്തിന്റെ ഒരു അംശം ഉണ്ട് .	2188694	In the wild fire of thought, there is an element of the destruction of the self.
2193220	അവന്‍ അത്യാഗ്രഹിയും ദയാരഹിതനും ആണ്.	1879784	He's greedy and ruthless.
2193223	ക്രിസ്തുമസ് ആശംസകള്‍.	1723	Merry Christmas!
2193226	എനിക്ക് മൂന്നു ഭാഷകള്‍ സംസാരിക്കാന്‍ കഴിഞ്ഞിരുന്നെങ്ങില്‍ നന്നായിരുന്നു.	2054058	It would be cool if I could speak three languages.
2226812	ഞാന്‍ എന്റെ നാവ് കടിച്ചു.	2226329	I bit my tongue.
2226814	അവന്‍ മലര്‍ന്നു കിടന്നു.	2225733	He lay down on his back.
2226820	ടോം വ്യാപാരത്തില്‍ എന്നേക്കാള്‍ അനുഭവജ്ഞന്‍ ആണ്.	2225524	Tom is more experienced in business than me.
2226828	അത് എന്നെ വളരെ സന്തോഷവാനാക്കി.	2225432	It made me very happy.
2226833	പഞ്ചസാര വെള്ളത്തില്‍ ലയിക്കും.	2225415	Sugar is soluble in water.
2226837	തീവ്രവാദികള്‍ ഒരു പള്ളി ആക്രമിച്ചു.	2225251	The terrorists attacked a mosque.
2226843	ഞാന്‍ ഒരു പുതിയ വിദ്യാര്‍ഥി ആണ്.	424866	I'm a new student.
2226846	ഇത് ശരിയായിരിക്കാം.	2224578	This may be correct.
2226848	മേരി അതീവ സുന്ദരി ആണ് .	2224009	Mary is quite attractive.
2279018	എന്താണ് നിങ്ങളുടെ ഇഷ്ടപ്പെട്ട നാടന്‍ ബിയര്‍?	906744	What's your favorite domestic beer?
2279026	നമുക്ക് ഒഴുക്കിനെതിരായി നീന്താന്‍ ശ്രമിക്കാം.	1723925	Let us try to swim against the current.
2279138	ടോം ചിരിച്ചു.	2111172	Tom giggled.
2279139	എനിക്ക് ബോസ്ടനിലേക്ക് തിരിച്ചു വരണം.	2033388	I want to be back in Boston.
2296436	ഞാന്‍ ടോമിനെ വെറുക്കുന്നു.	1392718	I hate Tom.
2296440	ആരാണ് നമ്മളെ ചതിച്ചത്?	2296177	Who betrayed us?
2296443	ടോം അര്‍ത്ഥമാക്കിയത് എന്താണ്?	1841429	What does Tom mean?
2296454	ഇത് ഞങ്ങളുടെ ബാഗ്‌ ആണ്.	2295735	This is our bag.
2296456	ഇത് ഞങ്ങളുടെതാണ്.	2295681	This is ours.
2296459	സത്യം പറയുന്ന ഒരു മനുഷ്യന് വേഗതയുള്ള ഒരു കുതിര ആവശ്യമാണ്.	2295644	A man who speaks the truth needs a fast horse.
2296462	അവന്‍ ധാരാളം സംസാരിക്കാറുണ്ട്.	2295540	He talks a lot.
2296464	അവന്‍ നിന്റെ അച്ഛന്‍ അല്ല.	2862895	He is not your father.
2296464	അവന്‍ നിന്റെ അച്ഛന്‍ അല്ല.	2862896	He is not your dad.
2296465	ഇത് ഒരു ത്രികോണം ആണ്.	2294789	This is a triangle.
2296468	ഞാന്‍ നിലം ഉഴുതു.	2294641	I plowed the field.
2296483	ഞാന്‍ ഒരു സ്ത്രീരോഗ വിദഗ്ധന്‍ ആണ്.	2302420	I'm a gynaecologist.
2296491	ഈ വെള്ളം മണമില്ലാത്തത് ആണ്.	2302415	This water is odourless.
2296493	അലൂമിനിയം ഒരു ലോഹം ആണ്.	2302306	Aluminium is a metal.
2296503	എനിക്ക് ഇവിടെ ജീവിക്കാന്‍ ആഗ്രഹമുണ്ട്.	2302407	I want to live here.
2296506	എനിക്ക് ഒരു കോഫി വേണം.	2302296	I want a coffee.
2296514	നിങ്ങള്‍ എന്നെ അന്വേഷിക്കുകയായിരുന്നു എന്ന് ഞാന്‍ വിശ്വസിക്കുന്നു.	2294065	I believe you've been looking for me.
2296515	നിങ്ങള്ക്ക് ടോമിനെ അറിയാം എന്ന് ഞാന്‍ വിചാരിക്കുന്നു.	2294062	I think you know Tom.
2296516	നിങ്ങള്‍ക്ക് ടോമിനെ അറിയാം എന്ന് ഞാന്‍ വിശ്വസിക്കുന്നു.	2294061	I believe you know Tom.
2296520	നിങ്ങള്‍ക്ക് നിയമങ്ങള്‍ അറിയാം എന്ന് ഞാന്‍ വിചാരിക്കുന്നു.	2294060	I think you know the rules.
2296523	നിങ്ങള്‍ക്ക് നിയമങ്ങള്‍ അറിയാം എന്ന് ഞാന്‍ വിശ്വസിക്കുന്നു.	2294059	I believe you know the rules.
2296526	നിങ്ങള്‍ക്ക് ഞങ്ങളെ സഹായിക്കാന്‍ കഴിയും എന്ന് ഞാന്‍ വിചാരിക്കുന്നു.	2294058	I think you can help us.
2300991	അടുത്ത പോപ്പ് ആരായിരിക്കും?	2300828	Who will be the next pope?
2300993	പൂച്ച എലിയെ പിടിച്ചു.	2300762	The cat caught the mouse.
2300995	നിങ്ങളുടെ വേദനക്ക് എനിക്ക് എന്തെങ്ങിലും തരാന്‍ കഴിയും.	2300739	I can give you something for your pain.
2300996	എനിക്ക് നിങ്ങള്‍ക്ക് കുറച്ചു ആവശ്യകരമായ ഇന്‍ഫര്‍മേഷന്‍ തരാം കഴിയും.	2300738	I can give you some useful information.
2300997	എനിക്ക് നിങ്ങള്ക്ക് ആവശ്യമെങ്കില്‍ കുറച്ചു പൈസ തരാന്‍ കഴിയും.	2300737	I can give you some money if you need it.
2300998	എനിക്ക് നിങ്ങള്‍ക്ക് കുറച്ചു വേദനയ്ക്കുള്ള മരുന്ന് തരാന്‍ കഴിയും.	2300736	I can give you some medicine for the pain.
2300999	എനിക്ക് നിങ്ങള്‍ക്ക് ലിഫ്റ്റ്‌ തരാന്‍ കഴിയും.	2300734	I can give you a lift.
2301001	എനിക്ക് നിങ്ങള്‍ക്ക് ടൌണിലേക്ക് ഒരു ലിഫ്റ്റ്‌ തരാന്‍ കഴിയും.	2300733	I can give you a lift into town.
2301003	എനിക്ക് ടോമിന് ഒരു മെസ്സേജ് കൊടുക്കാന്‍ കഴിയും.	2300732	I can give Tom a message.
2301005	എനിക്ക് ഇത് ഇപ്പോള്‍ തന്നെ നിങ്ങള്ക്ക് നല്കാന്‍ കഴിയും.	2300731	I can give it to you right now.
2301006	എനിക്ക് ഇത് പ്രയോഗിച്ചു നോക്കാന്‍ കഴിയും.	2300729	I can give it a shot.
2301006	എനിക്ക് ഇത് പ്രയോഗിച്ചു നോക്കാന്‍ കഴിയും.	2300730	I can give it a try.
2301008	എനിക്ക് നിങ്ങളെ ജയിലില്‍ നിന്നും പുറത്തിറക്കാന്‍ കഴിയും.	2300728	I can get you out of prison.
2301011	നിങ്ങള്‍ക്ക് ഇഷ്ടമാണെങ്കില്‍ ഇതുപോലൊരെണ്ണം തരാന്‍ കഴിയും.	2300727	I can get you one if you like.
2301014	എനിക്ക് ഇനിയും നിങ്ങള്‍ക്ക് തരാന്‍ കഴിയും.	2300726	I can get you more.
2301017	എനിക്ക് നിങ്ങളെ ജോലിയില്‍ നിന്നും പുറതാക്കിപ്പിക്കാന്‍ കഴിയും.	2300725	I can get you fired.
2301020	നിങ്ങള്‍ക്ക് ആവശ്യമായതെല്ലാം നല്കാന്‍ എനിക്ക് കഴിയും.	2300724	I can get you everything you need.
2727612	നിങ്ങൾ ടോമിനെക്കാൾ സമർത്ഥനാണ്.	1895573	You're smarter than Tom is.
2727625	നിങ്ങൾ ബാങ്ക് കൊള്ളയടിക്കുമ്പോൾ, നിങ്ങൾ ജയിലിൽ അടയ്ക്കപ്പെടുന്നു. ഒരു ബാങ്ക് നിങ്ങളെ കൊള്ളയടിക്കുമ്പോൾ, അവർ ലാഭവിഹിതങ്ങൾ വിതരണം ചെയ്യുന്നു.	1358549	Of course it's her.
2727625	നിങ്ങൾ ബാങ്ക് കൊള്ളയടിക്കുമ്പോൾ, നിങ്ങൾ ജയിലിൽ അടയ്ക്കപ്പെടുന്നു. ഒരു ബാങ്ക് നിങ്ങളെ കൊള്ളയടിക്കുമ്പോൾ, അവർ ലാഭവിഹിതങ്ങൾ വിതരണം ചെയ്യുന്നു.	1762010	When you rob a bank, you go to jail. When a bank robs you, they hand out bonuses.
2727630	തീര്‍ച്ചയായും അത് അവൾ തന്നെ ആണ്.	1358549	Of course it's her.
2727631	മധുരപലഹാരം മേശക്കു കീഴിൽ ഉണ്ട്.	63007	Cookie is under the table.
2727632	ഈ പർവത പാത മനോഹരമായ തടാകത്തിനടുത്തേക്ക് കയറിച്ചെല്ലുന്നു.	59174	This mountain path ascends to the beautiful lake.
2727633	അവൻ വൈദ്യശാസ്ത്രത്തിനുവേണ്ടി അവന്റെ ജീവിതം സമർപ്പിച്ചു.	293650	He dedicated his life to medical work.
2727634	ടോം പേജ് മറിച്ചു.	2548066	Tom turned the page.
2727635	നിങ്ങൾ വീട്ടിലേക്കു പോകണം എന്ന് ഞാൻ കരുതുന്നു.	2458492	I think you should go home.
2727646	അവൻ ചെയ്തത് എന്താണോ അത് തെറ്റല്ല.	465974	What he did wasn't wrong.
2730709	അവൾ ഒരു വിദ്യാർത്ഥിനി അല്ല.	2730661	She is not a student.
2730711	അവൻ ഒരു വിദ്യാർത്ഥി അല്ല.	2730657	He is not a student.
2730712	ഞാൻ ഒരു എഞ്ചിനീയർ ആണ്.	2730653	I am an engineer.
2730713	എൻറെ പേര് ജാക്ക് എന്നാണ്.	1646	My name is Jack.
2730715	എനിക്ക് ഇത് വായിക്കാൻ കഴിയുന്നില്ല.	1954727	I can't read this.
2730719	എൻറെ വർത്തമാനപത്രം എവിടെയാണ്.	1963344	Where is my newspaper?
2730720	എൻറെ ഡയറി എവിടെയാണ്.	2730409	Where is my diary?
2730721	മണ്ടത്തരത്തിന് പരിധികളില്ല.	2730212	Ignorance has no limits.
2730722	തീർച്ചയായും ഞാൻ അവളെ സ്നേഹിക്കുന്നു.	2730079	Of course I love her!
2730723	ഞാൻ എൻറെ അവസാന പരീക്ഷ എഴുതുക ആണ്.	2730041	I am taking my final exam.
2730726	മാരിയോ എന്നോട് കളവു പറഞ്ഞതിനാൽ, മേലിൽ അവനോടു ഞാൻ സംസാരിക്കുകയില്ല.	2303	Since Mario lied to me, I don't speak to him anymore.
2730729	ഞാൻ എന്റെ മേലധികാരിയോട് ശമ്പളം കൂട്ടി ചോദിച്ചു.	258384	I asked my boss for a pay increase.
2730730	മേരി നല്ലൊരു പാചകക്കാരി അല്ലെന്നു ടോം കരുതി.	2309391	Tom thought Mary wasn't a very good cook.
2730732	ഒരു മിനുട്ടിനകം ഡോക്ടർ ഇവിടെ എത്തും.	954343	The doctor will be here in a minute.
2730733	അവൻ എന്തായാലും ചെയ്തു.	2556255	He did it anyway.
2730735	എല്ലാം ഒഴുകുന്നു, ഒന്നും നിശ്ചലമായി നില്ക്കുന്നില്ല.	907671	Everything flows, nothing stands still.
2730736	അത് എന്റേതല്ലേ?	2248691	Isn't that mine?
2730737	അപ്പോൾ നിങ്ങൾ മാഡ്രിഡിൽ ആയിരുന്നു എന്നത് ശരിയാണോ?	1728477	Is it true that you were in Madrid then?
2740596	മനുഷ്യന്‍, ഒരേസമയം, ഏകാന്ത ജീവിയും സാമൂഹ്യജീവിയുമാണ്.	2740594	Man is, at one and the same time, a solitary being and a social being.
2740598	സാമൂഹ്യജീവിയെന്ന നിലയില്‍ സഹജീവികളുടെ സ്നേഹത്തിനും അംഗീകാരത്തിനും വേണ്ടി ശ്രമിക്കുകയും അവരുടെ നൊമ്പരങ്ങളും സന്തോഷങ്ങളും പങ്കുവെയ്ക്കുകയും ചെയ്യുന്നു.	2740597	As a social being, he seeks to gain the recognition and affection of his fellow human beings, to share in their pleasures, to comfort them in their sorrows, and to improve their conditions of life.
2740601	നിലവിലുള്ള മുതലാളിത്ത സമൂഹത്തിന്റെ സാമ്പത്തിക സാമൂഹ്യ അരാജകത്വമാണ് പ്രധാന പ്രതിയെന്ന് ഞാന്‍ കരുതുന്നു.	2740600	The economic anarchy of capitalist society as it exists today is, in my opinion, the real source of the evil.
2741031	എനിക്ക് വിശക്കുന്നു എന്ന് അവളോട്‌ പറയു.	1741638	Tell her that I am hungry.
2741032	ഭൂമി ഉരുണ്ടതാണ്.	277121	The earth is round.
2741033	ഭൂമി ഉരുണ്ടത്‌ ആണ്.	277121	The earth is round.
2741034	നിങ്ങൾ എന്താണ് അന്വേഷിക്കുന്നത് എന്ന് എനിക്ക് അറിയില്ല.	2315303	I don't know what you're looking for.
2741035	അവൾ മരിച്ചിട്ട് പത്ത് വർഷങ്ങൾ ആയി.	308309	She has been dead for ten years.
2792789	അവൾ അവനെ ശാസിച്ചു.	887375	She scolded him.
2792805	ടോമും ഞാനും കഴിഞ്ഞയാഴ്ച വളരെ തിരക്കിലായിരുന്നു.	2641712	Tom and I were very busy last week.
2792810	ടോമിന്റെ കുടുംബത്തെപ്പറ്റി നിനക്കെന്തെങ്കിലും അറിയാമോ?	1552460	Do you know anything about Tom's family?
2792813	ടോമിന് ഒരു സഹായവും ആവശ്യമില്ലായിരുന്നു.	1094681	Tom didn't need any help.
2792815	ആരും എന്നോടൊന്നും പറയാറില്ല.	1635590	Nobody tells me anything.
2792816	അവർ താമസിക്കാനായി ഒരു വീടു നോക്കിക്കൊണ്ടിരിക്കുകയാണ്.	306840	They are looking for a house to live in.
2792818	നമ്മൾ ഭൂമിയിൽ ജീവിക്കുന്നു.	249064	We live on the earth.
2792821	ആരെയും വിശ്വസിക്കരുത്.	2091089	Trust no one.
2792823	കുട്ടികളുടെ എണ്ണം കുറഞ്ഞുവരികയാണ്.	1313722	The number of students is dropping.
2792826	പൂന്തോട്ടത്തിൽ പ്രവേശിക്കാൻ അവർ നമ്മളെ അനുവദിക്കില്ല.	306651	They won't allow us to enter the garden.
2792851	നമുക്കു വളരെക്കുറച്ചു സമയം മാത്രമേയുള്ളൂ.	2545078	We have very little time.
2792853	അപകടങ്ങൾ സംഭവിക്കുന്നു.	1600344	Accidents happen.
2862866	വളരെ നാളായല്ലൊ കണ്ടിട്ട്	2862869	I have not seen you for a long time.
2862866	വളരെ നാളായല്ലൊ കണ്ടിട്ട്	2862873	Long time no see.
2862884	നിങ്ങള്‍ മലയാളം സംസാരിക്കുമോ?	2862885	Do you speak Malayalam?
3178043	അവൾ സുന്ദരിയാണ്‌.	410244	She is beautiful.
3367791	നിങ്ങൾ എന്തിന് ഇതു ചെയ്യുന്നു?	3367754	Why are you doing this?
3367807	ഞാൻ ടോം'ഇനെ കഴിഞ്ഞ തിങ്കളാഴ്ച പാർകിൽ വെച്ച് മെരിയുടെ കു‌ടെ നടകുന്നത് കണ്ടു	3367765	I saw Tom last Monday walking in the park with Mary.
3574833	അവർ നമ്മളെ കണ്ടിട്ടുണ്ടാവുമോ?	2995279	Have they seen us?
3574836	ടോം നേരെ ഉറങ്ങാൻ പോയി.	1092292	Tom went straight to bed.
3712120	അഭയാര്‍ത്ഥികളെ സഹായിക്കുവാനുള്ള പണത്തിനായി അവര്‍ അപേക്ഷിക്കുകയാണ്.	307267	They are appealing for money to help refugees.
3712126	രണ്ടുപേരും ദയാലുക്കളും ആത്മാര്‍ത്ഥതയുള്ളവരുമാണ്.	307270	Both of them are kind and honest.
3712127	അവര്‍ ഒരിക്കലും കണ്ടുമുട്ടുമായിരുന്നില്ല.	307271	They would never meet again.
3712128	അവര്‍ ജപ്പാനില്‍ സ്ഥിരതാമസമാക്കി.	307279	They settled in Japan.
3712135	കാറ് തണലില്‍ നിര്‍ത്തൂ.	3259601	Park the car in the shade.
3712137	ആ സ്വര്‍ണമോതിരം എന്റെ അമ്മയുടേതാണ്.	3259605	That gold ring belonged to my mother.
3712142	അവര്‍ പരസ്പരം വെറുത്തു.	280931	They hated each other.
3714396	എന്റെ പേര് എമിലി.	2566189	My name is Emily.
3715623	കടലിൽ ദ്വീപുകൽ ഉണ്ട്.	3663249	There are islands in the sea.
3885680	ഇന്ന് ലോകത്തിലെ ഏറ്റവു ഉയരം കൂടിയ കെട്ടിടം ബുർജ് ഖലീഫ ആണ്.	1577672	Burj Khalifa is currently the tallest building in the world.
3944132	ഞാൻ കേൾക്കാൻ ആഗ്രഹിക്കുന്ന വാക്കുകൾ കൊണ്ട് ഞാൻ എപ്പോഴും ജനങ്ങളെ ആശ്വസിപ്പിക്കാൻ ശ്രമിക്കുന്നു	3944112	I always find myself comforting people with the words I want to hear.
3964449	ബുർജ് ഖലീഫ നിലവിൽ ലോകത്തിലെ ഏറ്റവും ഉയരുമുള്ള കെട്ടിടം ആണ്.	1399479	Burj Khalifa is currently the tallest skyscraper in the world.
3885680	ഇന്ന് ലോകത്തിലെ ഏറ്റവു ഉയരം കൂടിയ കെട്ടിടം ബുർജ് ഖലീഫ ആണ്.	1399479	Burj Khalifa is currently the tallest skyscraper in the world.
4546232	സമയം എന്തായി?	428402	What time is it?
3665570	നിങ്ങൾ ആരാണ്?	356200	Who are you?
651913	നമസ്കാരം.	1858850	Hello.
5494132	സമയം എത്രയായി?	1259876	What is the time?
5494134	അവരെക്കൊണ്ട് ഇപ്പോൾ ഉപയോഗമില്ല.	2243698	They're useless now.
5494136	ഞാൻ ഇപ്പോൾ തിരിച്ച് എത്തിയതേയുള്ളൂ.	2362200	I just got back.
5494139	എന്റെ പേര് എമിലി എന്നാണ്.	2566189	My name is Emily.
5494542	ഞാൻ നിന്നെ വിശ്വസിക്കുന്നു.	17421	I believe you.
5494545	നിനക്ക് ഓർമ്മയുണ്ടോ.	21678	Do you remember?
5494550	ഞാൻ ഒരു അമേരിക്കൻ ആണ്.	461975	I am American.
5494553	പകുതി എനിക്ക് തരൂ.	2043700	Give me half.
6402551	സുപ്രഭാതം!	329713	Good morning!
3194107	അവൾ വന്നു	6917619	She arrived.
2987838	എനിക്ക് ഒന്നും കേള്കുന്നില്ല	6917622	I cannot hear anything.
2766999	എവിടെ പോകുന്നു	416367	Where are you going?
2296502	അവന്‍ ലെണ്ടനിലേക്ക്‌ ഒരു യാത്ര ആസൂത്രണം ചെയ്തു.	6917624	They are planning a trip to London.
2296508	ഞാന്‍ ഈ ലോകത്തില്‍ ജീവിക്കുന്നു.	6917627	I live in this world.
2296510	വാതില്‍ പൂട്ടിയിരിക്കുന്നു.	1112479	The door is locked.
2296511	എനിക്ക് ഒരു പച്ച കുപ്പായം ഉണ്ട്.	2630819	I have a green shirt.
2296476	എനിക്ക് ഉയരം ഭയമാണ്.	1392418	I am afraid of heights.
2296450	കടല്‍ നീലയാണ്.	2396999	The sea is blue.
2226885	ഇവിടെ പോക്കറ്റടിക്കാരെ സൂക്ഷിക്കുക.	6917634	Be careful of pickpockets here.
2187034	എന്റെ സുഹൃത്ത്‌ ഒരു ഘടികാരം വാങ്ങിച്ചു എന്ന് അവന്‍ പറഞ്ഞു.	6917638	My friend told me he bought a clock.
2073515	നീ എവിടെയായിരുന്നു	16486	Where were you?
1653878	ഞാന്‍ സ്നേഹിക്കുന്ന പോലെ നീയും എന്നെ സ്നേഹിച്ചിരുന്നെങ്കില്‍	6917642	Only if you loved me the way I loved you.
