650607	അഞ്ചുശരങ്ങളും പോരാതെ മന്മഥന്‍ നിന്‍ ചിരി സായകമാക്കി.	2187311	Kamdev has used your smile as an arrow as all the five arrows were found insufficient.
650676	പെട്ടെന്ന് അവന്‍ എന്നെ കണ്ടു.	650268	Suddenly he saw me.
650682	ദയവായി നിങ്ങളുടെ കുടുംബത്തെ പറ്റി ഞങ്ങളോട് പറയൂ.	649974	Please tell us about your family.
650709	നിങ്ങള്‍ എപ്പോഴെങ്കിലും ഒരു തിമിംഗലത്തെ കണ്ടിട്ടുണ്ടോ?	69421	Have you ever seen a whale?
650735	നിങ്ങള്‍ ഈ പുസ്തകം വായിക്കണം.	645080	You must read this book.
650749	ഞാന്‍ അവന്‍ വരുമെന്ന് വിചാരിച്ചു.	641018	I thought that he would come.
651275	അവള്‍ക്ക് ഐസ് ക്രീം ഇഷ്ടമാണ്.	650986	She likes ice cream.
651279	ഇന്നലെ ഞാനൊരു നായയെ വാങ്ങിച്ചു. ദൗര്‍ഭാഗ്യവശാല്‍ എന്റെ മാമി അതിനെ അത്താഴത്തിന് പാചകം ചെയ്തു.	651218	Yesterday I bought a dog. Sadly my aunt cooked it for dinner.
651324	എന്റെ മകന് എന്നേക്കാള്‍ ഉയരമുണ്ട്.	467341	My son is taller than I am.
651381	ഞാന്‍ ദൈവത്തില്‍ വിശ്വസിക്കുന്നില്ല.	506536	I don't believe in God.
651384	ഞാന്‍ അവനെ സന്ദര്‍ശിച്ചപ്പോള്‍ അവന്‍ വായനയില്‍ മുഴുകിയിരിക്കുകയായിരുന്നു.	247029	He was absorbed in reading when I visited him.
651477	ഈ കെട്ടിടത്തില്‍ ആരും താമസിക്കുന്നില്ല.	451748	No one lives in this building.
651480	നിങ്ങള്‍ ഏതു വര്‍ഷമാണ് ജനിച്ചത്?	509620	What year were you born?
651485	ആരും എന്നെ മനസ്സിലാക്കുന്നില്ല.	1484	Nobody understands me.
651492	ആരും ജോലി ചെയ്യുന്നില്ല. എല്ലാവരും ലോകകപ്പ് കാണുകയാണ്.	404295	No one is working. Everyone's watching the World Cup.
651494	ആ മരുന്ന് അവളുടെ ജീവന്‍ രക്ഷിച്ചു.	43566	The medicine saved her life.
651495	അവന്‍ ഊണ് കഴിക്കാന്‍ തുടങ്ങി.	301555	He began to eat lunch.
651499	ദയവായി നിങ്ങള്‍ സംസാരിക്കുന്നതിന് മുമ്പ് നിങ്ങളുടെ കൈ ഉയര്‍ത്തുക.	326568	Please raise your hand before you speak.
651928	വെളിച്ചം ശബ്ദത്തേക്കാള്‍ വേഗത്തില്‍ യാത്ര ചെയ്യുമെന്ന് നിങ്ങള്‍ക്കെങ്ങനെ അറിയാം?	240378	How do you know that light travels faster than sound?
651935	ബസ്സില്‍ പോകുന്നതാണ് ലാഭം.	35382	It is cheaper to go by bus.
651936	വന്യ മൃഗങ്ങള്‍ കാട്ടിലാണ് ജീവിക്കുന്നത്.	324123	Wild animals live in the forest.
651937	അവന് ഞങ്ങളെ ഇഷ്ടമല്ല.	322029	He doesn't like us.
651938	അവള്‍ പറഞ്ഞതെന്താണെന്ന് എനിക്ക് മനസ്സിലാക്കാന്‍ സാധിക്കുന്നില്ല.	261260	I can't make out what she said.
651939	ആ വാതില്‍ അകത്തു നിന്ന് പൂട്ടിയിരിക്കുകയായിരുന്നു.	39062	The door was locked from within.
651940	ഞാന്‍ മറന്നു.	436603	I forgot.
651941	ആര്‍ക്കും രണ്ടു കാര്യങ്ങള്‍ ഒരേ സമയത്ത് ചെയ്യാന്‍ സാധിക്കുകയില്ല.	72925	Nobody can do two things at once.
651942	ഇന്ന് രാത്രി മഴ പെയ്തേക്കും.	243400	It may rain tonight.
652202	എനിക്കൊരു ചുറ്റിക വേണം.	436815	I need a hammer.
652203	ഞാന്‍ ഇതൊഴിച്ച് വേറെ എന്തു വേണമെങ്കിലും ചെയ്യാം.	54920	I will do anything but this.
652204	എവിടെയാണ് വേദനിക്കുന്നത്?	37512	Where does it hurt?
652212	ആര് വന്നാലും വാതില്‍ തുറക്കണ്ട.	40420	Whoever comes, don't open the door.
652221	എന്റെ ജീവിതത്തിലെ ഏറ്റവും വേദനാജനകമായ അനുഭവം അതായിരിക്കും.	27590	That might be the most painful experience in my life.
652224	ഇംഗ്ലീഷ് പഠിക്കാന്‍ എളുപ്പമാണ്.	26285	English is easy to learn.
652225	ജൂഡി നന്നായി നൃത്തം ചെയ്യും.	53014	Judy dances very well.
652226	ആ പൂച്ച മേശപ്പുറത്ത് ഉറങ്ങി.	282032	The cat slept on the table.
652227	അവന്‍ രണ്ടാഴ്ചയ്ക്കുള്ളില്‍ തിരിച്ചു വരും.	293046	He will come back in another two weeks.
652229	ആ സിനിമ അവള്‍ക്ക് വളരെയധികം പ്രശസ്തി നേടി കൊടുത്തു.	49566	The movie gained her great popularity.
652230	ഈ സ്ഥലത്താണ് ആ യുദ്ധം നടന്നത്.	62157	This is the place where the battle took place.
652231	ദൗര്‍ഭാഗ്യവശാല്‍ എനിക്കവരെ സഹായിക്കാന്‍ കഴിയില്ല.	464304	Unfortunately, I cannot help them.
652232	നമുക്ക് സമയമില്ല.	449441	We don't have time.
652233	അവന്‍ ഫലങ്ങള്‍ വില്‍ക്കുന്നു.	434998	He sells fruit.
652235	ഞാന്‍ പ്രതീക്ഷച്ചതിനേക്കാള്‍ വലുതാണ് ഈ പൂന്തോട്ടം.	278505	The garden was larger than I had expected.
652237	അമേരിക്കന്‍ വിദ്യാര്‍ത്ഥികള്‍ കണക്കില്‍ പിന്തള്ളപ്പെട്ടു കൊണ്ടിരിക്കുകയാണ്.	67585	American students are falling behind in math.
652238	ഒന്നിനും അവനെ സ്വാധീനിക്കാന്‍ കഴിയുകയില്ല.	38362	Nothing would persuade him.
652239	എല്ലാ പുസ്തകങ്ങളെയും രണ്ടു വിഭാഗങ്ങളിലായി വേര്‍തിരിക്കാന്‍ സാധിക്കും.	273709	All books may be divided into two classes.
652240	ഈ വാക്യത്തിന് ഒന്നില്‍ കൂടുതല്‍ അര്‍ത്ഥങ്ങളുണ്ട്.	57232	The meaning of this sentence is ambiguous.
652241	അവനെ മൂന്ന് വര്‍ഷത്തെ തടവിനായി വിധിച്ചു.	277726	He was sentenced to three years in jail.
652242	നീ നേരത്തെ വരണമായിരുന്നു.	16378	You should have come earlier.
652243	നിനക്ക് ഇവിടെ ഇരിക്കാം.	61758	You may sit here.
652244	പരീക്ഷകളില്‍ ബുദ്ധിമാന്‍മാര്‍ക്ക് ഉത്തരം ചെയ്യാന്‍ പറ്റാത്ത ചോദ്യങ്ങള്‍ മന്ദബുദ്ധികള്‍ ചോദിക്കുന്നു.	263458	In examinations the foolish ask questions that the wise cannot answer.
652247	അവള്‍ നന്നായി പാചകം ചെയ്യും.	317439	She cooks well.
652282	ഞാന്‍ ടോണിയെ സഹായിച്ചു.	255269	I helped Tony.
652318	എന്റെ സഹോദരി എല്ലാ ഞായറാഴ്ചയും അവളുടെ ചെരിപ്പുകള്‍ കഴുകും.	245601	My sister washes her shoes every Sunday.
652319	ബോബ് എന്നെ സഹായിച്ചു.	33256	Bob helped me.
652320	ടോം ജപ്പാനില്‍ പത്തു വര്‍ഷം ജീവിച്ചു.	37332	Tom lived in Japan for ten years.
652321	ബ്രസീലിന്റെ പ്രധാന ഉല്പന്നം കാപ്പിയാണ്.	62244	Coffee is Brazil's main product.
652322	ഞാന്‍ എന്റെ അമ്മൂമ്മയെ സന്ദര്‍ശിച്ചിട്ട് കുറെ നാളായി.	505718	It's been a long time since I visited my grandmother.
652323	സൂര്യന്‍ ഭൂമിയില്‍ നിന്ന് വളരെ ദൂരെയാണ്.	275143	The sun is so distant from the earth.
652324	എനിക്ക് ടികറ്റ് സൗജന്യമായി ലഭിച്ചു.	261890	I got the ticket for free.
652329	മത്സ്യങ്ങള്‍ക്ക് വെള്ളത്തിന് പുറത്ത് ജീവിക്കാന്‍ സാധിക്കില്ല.	19347	Fish cannot live out of water.
652334	ശബ്ദമുണ്ടാക്കരുത്.	477063	Don't make noise.
652335	അവള്‍ ഭാവിയില്‍ പ്രശസ്തയാകും.	315003	She will be famous in the future.
652378	കഴിഞ്ഞയാഴ്ച അവര്‍ക്കൊരു കുട്ടിയുണ്ടായി.	305096	They had a baby last week.
652381	ഒട്ടകപ്പക്ഷിക്ക് ചിറകുകളുണ്ട്, പക്ഷേ അതിന് പറക്കാന്‍ സാധിക്കില്ല.	40840	The ostrich has wings, but it cannot fly.
652382	എനിക്ക് അവന്റെ ആരോഗ്യത്തെപ്പറ്റി ആശങ്കയുണ്ട്.	285983	I am concerned about his health.
652384	അവള്‍ മുപ്പതു വര്‍ഷം സംഗീതം പഠിപ്പിച്ചു.	310155	She taught music for thirty years.
652385	അവന്‍ വീട്ടില്‍ എത്തിച്ചേര്‍ന്നയുടന്‍ മഴ പെയ്യാന്‍ തുടങ്ങി.	391600	It rained as soon as he got home.
652386	എന്റെ അറിവില്‍ അവനൊരു സത്യസന്ധനമാണ്.	471437	As far as I know, he's an honest man.
652387	വിയന്ന മനോഹരമായ ഒരു നഗരമാണ്.	65699	Vienna is a beautiful city.
652392	ആ മുറി അത്ര വലുതല്ല.	67832	That room is not very large.
652438	എനിക്ക് പാചകം ചെയ്യാന്‍ അറിയില്ല.	325787	I don't know how to cook.
652455	വിശപ്പ് അവനെ മോഷ്ടിക്കാന്‍ പ്രേരിപ്പിച്ചു.	18161	Hunger drove him to steal.
652652	അവന്‍ മൂന്ന് ദിവസം കഴിഞ്ഞ് വീട്ടില്‍ തിരിച്ചെത്തി.	467668	He came back home three days later.
652653	അവള്‍ക്കൊരു ചെറിയ കറുത്ത പട്ടിയുണ്ട്.	315007	She has a small black dog.
652654	അവന്‍ അവളുടെ മുഖത്തേക്ക് തുറിച്ച് നോക്കി.	302770	He stared her in the face.
652656	ഞാന്‍ ഈ പട്ടണത്തില്‍ തികച്ചും ഒരു അപരിചിതനാണ്.	57829	I'm quite a stranger in this town.
653454	ഒരു ദിവസത്തില്‍ ഇരുപത്തി നാല് മണിക്കൂര്‍ ഉണ്ട്.	653144	There are twenty-four hours in a day.
653455	ഒരു മനുഷ്യന് പത്ത് വിരലുകളുണ്ട്.	653105	A man has ten fingers.
653457	നീ ആ ചിത്രത്തില്‍ എന്താണ് കാണുന്നത്?	653060	What do you see in the picture?
653458	അഹിംസയുടെ അപ്പസ്തോലനായ മഹാത്മ ഗാന്ധി, 1869-ലാണ് ജനിച്ചത്.	317960	Mahatma Gandhi, the apostle of nonviolence, was born in 1869.
653459	നിന്റെ പ്രിയപ്പെട്ട കളിക്കാരനാരാണ്?	240692	Who is your favorite player?
653460	നീ നാളെ തിരിച്ചു വരുമോ?	431120	Will you come back tomorrow?
653461	അവന്‍ ആ ശബ്ദം കേട്ടു.	300912	He heard the noise.
653463	കണ്ണ് ആത്മാവിന്റെ കണ്ണാടിയാണ്.	323764	The eye is the mirror of the soul.
653464	ഞാന്‍ കാര്‍ നന്നാക്കുന്നതിന് വേണ്ടി മൂന്ന് മണിക്കൂര്‍ ചെലവഴിച്ചു.	254463	I spent three hours repairing the car.
653465	ദയവായി ആ ജനാല തുറക്കൂ	274213	Please open the window.
653466	അവന് അമേരിക്കയില്‍ പോകാന്‍ ആഗ്രഹമുണ്ട്.	252995	He wants to go to America.
653483	ഞാനൊരു വിദ്യാര്‍ത്ഥിയല്ല.	258994	I'm not a student.
653485	അതിനെപ്പറ്റി തര്‍ക്കിച്ചിട്ട് ഒരു കാര്യവുമില്ല.	42923	It is no use arguing about it.
653488	ആരാണ് ആ പെൺകുട്ടി?	68220	Who's that girl?
653775	ആ വാര്‍ത്ത കാട്ടുതീ പോലെ പടര്‍ന്നു.	50118	The news spread like wildfire.
653777	അവള്‍ ലോകമെമ്പാടും സഞ്ചരിച്ചു.	315297	She traveled all over the world.
653789	ക്ഷമിക്കണം. എല്ലാം എന്റെ തെറ്റാണ്.	56374	Sorry. It's all my fault.
653802	എനിക്ക് ഈ പുസ്തകം ഇംഗ്ലീഷിലേക്ക് തര്‍ജ്ജമ ചെയ്താല്‍ കൊള്ളാമെന്നുണ്ട്.	71158	I'd like you to translate this book into English.
654472	ഞാന്‍ അവിടെയായിരുന്നപ്പോള്‍ ഇംഗ്ലീഷ് പഠിച്ചു.	252165	I studied English when I was there.
654477	ഞങ്ങള്‍ അവള്‍ കരയുന്നത് കേട്ടു.	308241	We heard her cry.
654479	അവര്‍ പ്രതീക്ഷ കൈവിട്ടില്ല.	305457	They did not give up hope.
654483	എനിക്ക് കാപ്പി ഇഷ്ടമല്ല.	435422	I hate coffee.
654488	നിങ്ങള്‍ സഹകരിച്ചാല്‍ ഈ ജോലി ചെയ്യാന്‍ എനിക്ക് താല്പര്യമുണ്ട്.	19242	I'm willing to do the job if you cooperate.
654759	എനിക്ക് നന്നായി ഉറങ്ങാന്‍ പറ്റുന്നില്ല.	29912	I can't sleep well.
654764	ഞാന്‍ അവനെ മുമ്പ് കണ്ടതായി ഓര്‍ക്കുന്നു.	273579	I remember seeing him before.
655791	ഞാന്‍ കാല്‍പ്പന്ത് കളിച്ചു.	255512	I played football.
655867	എനിക്ക് ജീവിക്കണം.	261906	I want to live.
655868	എന്റെ കാര്‍ എവിടെയാണ്?	251080	Where is my car?
656091	എനിക്ക് ആ പ്രശ്നം പരിഹരിക്കാന്‍ സാധിച്ചു.	254705	I was able to solve the problem.
656092	ഞങ്ങള്‍ അവിടെ മൂന്ന് മാസം താമസിച്ചു.	248048	We stayed there for three months.
656093	ഞാന്‍ റോമില്‍ പോയിട്ടുണ്ട്.	371414	I have been to Rome.
656095	എന്റെ വയറ് നിറഞ്ഞു.	64037	My stomach is full.
656096	പൊക്കമില്ലായ്മ ജീവിതത്തില്‍ അത്ര വലിയ പോരായ്മയല്ല.	282440	Not being tall is not a serious disadvantage in life.
656098	പുകവലി നിര്‍ത്താന്‍ ഡോക്ടര്‍ അവനെ നിര്‍ദ്ദേശിച്ചു.	27937	The doctor suggested that he give up smoking.
656101	നമുക്ക് അത് പിന്നെ ചര്‍ച്ച ചെയ്യാം.	49200	We will discuss that later.
660529	ജാക്കിന് ചിത്രരചനയിൽ താൽപ്പര്യമുണ്ട്.	53125	Jack is interested in painting.
660530	കണക്ക് പരീക്ഷ എങ്ങനെയുണ്ടായിരുന്നു?	270999	How was the math test?
660531	ആ വാതിൽ അടയ്ക്കൂ.	38992	Shut the door.
662295	എനിക്ക് ടിവി കാണാൻ ഇഷ്ടമാണ്.	255108	I like to watch TV.
662425	അങ്ങനെയാണെങ്കിൽ, പോലീസിനെ വിളിക്കൂ.	46206	In that case, call the police.
662433	അവൻ ജീവിക്കാൻ പാടില്ല.	271710	He must not live.
662462	അഞ്ച് ദിവസം തുടർച്ചയായി മഴ പെയ്തു.	72494	It rained five successive days.
663070	ഞാൻ ഇന്നലെ രാത്രി ഒരു ദുസ്വപ്നം കണ്ടു.	257828	I had a bad dream last night.
663082	ദയവായി, അതെനിക്കു തരൂ.	41825	Give it to me, please.
665025	ടോം ബസ്സിന്റെ മുമ്പിൽ ഇരിക്കുകയായിരുന്നു.	37221	Tom was sitting in the front of the bus.
665026	കാഴ്ച അഞ്ച് ഇന്ദ്രിയങ്ങളിൽ ഒന്നാണ്.	263374	Sight is one of the five senses.
665268	ഞാൻ നിനക്ക് കുറച്ച് ചിത്രങ്ങൾ കാണിച്ചു തരാം.	71094	I will show you some pictures.
665270	ഈ വിവരം വളരെയധികം ആളുകൾക്ക് ഉപകാരപ്രദമാണ്.	46181	The information is useful to a great many people.
665273	അവൻ ഫ്രാൻസിലേക്ക് പോകാൻ തീരുമാനിച്ചു.	292600	He decided to go to France.
665308	ഞാൻ ഒരു കൈ കൊണ്ട് പന്ത് പിടിച്ചു.	255581	I caught the ball with one hand.
665313	അവളുടെ കാഴ്ചപ്പാടിൽ നിന്ന് ആ പ്രശ്നത്തെ കാണാൻ ശ്രമിക്കൂ.	309853	Try to see the problem from her point of view.
665315	നിനക്ക് മഞ്ഞ് ഇഷ്ടമാണോ?	434606	Do you like snow?
665318	അടുത്ത ട്രെയിനിലെ തിരക്ക് ഇതിനേക്കാൾ കുറവായിരിക്കും.	264339	The next train will be less crowded than this one.
665323	കാത്തിരുന്നിട്ട് കാര്യമില്ല.	275300	There's no point in waiting.
665330	അവളുടെ വാക്കുകൾ എന്നെ ഭ്രാന്തനാക്കി.	308868	Her words made me mad.
665333	അത് അസാധ്യമാണ്.	41295	That's impossible.
666257	ആരും എന്നെ സഹായിക്കാൻ വന്നില്ല.	276631	Nobody came to help me.
666263	നിങ്ങൾ ഈ പട്ടണത്തിലുണ്ടായിരുന്നുവെന്ന് എനിക്ക് അറിയില്ലായിരുന്നു.	18031	I didn't know that you were in this town.
666290	ഞാൻ നിങ്ങളെ എവിടെയോ കണ്ടതായി ഓർക്കുന്നു.	38247	I remember meeting you somewhere.
666293	അവൾക്കേതു നിറമാണ് ഇഷ്ടമുള്ളതെന്ന് നിനക്ക് അറിയാമോ?	311849	Do you know what color she likes?
666298	മേശക്കടിയിൽ ഒരു കറുത്ത പൂച്ചയുണ്ടായിരുന്നു.	39626	Under the table was a black cat.
666299	ഞങ്ങൾ അവനിൽ നിന്നും ഏറെ പ്രതീക്ഷിക്കുന്നു.	403382	We expect a lot from him.
668636	അവനെനിക്കൊരു സമ്മാനം അയച്ചു തന്നു.	297540	He sent me a present.
670455	നിങ്ങൾ ഒരു അധ്യാപകനാണ്.	69155	You are a teacher.
670456	ഞാൻ ടെന്നിസ് കളിക്കാൻ പോവുകയാണ്.	255099	I am going to play tennis.
670457	ആദ്യനോട്ടത്തിൽ തന്നെ ഞാൻ അവനെ തിരിച്ചറിഞ്ഞു.	256116	I recognized him at first glance.
671524	നാളെ മഴ പെയ്യുമെന്ന് എനിക്ക് തോന്നുന്നില്ല.	323269	I don't think it'll rain tomorrow.
672234	ആ പട്ടണം ഒരു നഗരമായ് വളർന്നു.	45040	The town grew into a city.
672307	ഞാൻ ഇതുവരെ എന്റെ അമ്മാവന്റെ വീട്ടിൽ പോയിട്ടില്ല.	253226	I've never been to my uncle's house.
672967	ഞാൻ ഒരു പക്ഷിയായിരുന്നെങ്കിൽ, എനിക്ക് നിന്റെ അടുത്തേക്ക് പറന്നു വരാമായിരുന്നു.	278179	If I had been a bird, I could have flown to you.
672973	അവൾക്ക് ആകർഷണീയമായ കണ്ണുകളുണ്ട്.	317194	She has attractive eyes.
674280	അവൻ നമ്മുടെ ടീമിന്റെ നായകനാകാൻ യോഗ്യനാണ്.	293401	He is worthy to be captain of our team.
674288	അവന്റെ കുതിര വേലിക്ക് മുകളിലൂടെ ചാടി.	287303	His horse jumped over the fence.
674303	അവനൊരു പുതിയ കാർ വേണം.	299901	He wants a new car.
678177	നാളെ വീണ്ടും വരൂ.	323324	Come again tomorrow.
679362	ഈ കസേര വളരെ ചെറുതാണ്.	463270	This chair is too small.
707639	അവന് അവന്റെ കഴിവിൽ ആത്മവിശ്വാസമുണ്ട്.	298817	He is confident of his ability.
708470	എല്ലാത്തിനും അതിന്റേതായ സമയമുണ്ട്.	319884	There is a time for all things.
708472	അവൻ ടോമിനേക്കാൾ വളരെ ചെറുപ്പമാണ്.	292105	He's much younger than Tom.
708477	ഞാൻ അവളുടെ നിഘണ്ടു അവൾക്ക് തിരിച്ചു കൊടുത്തു.	646848	I gave her her dictionary back.
708485	അവൻ സത്യം പറഞ്ഞു.	299984	He told the truth.
708494	സർക്കാർ വിദ്യാഭ്യാസത്തെ പരിഷ്ക്കരിച്ചു കൊണ്ടിരിക്കുകയാണ്.	271461	The government has been reforming education.
710400	അവന് എന്നേക്കാൾ വേഗത്തിൽ ഓടാൻ കഴിയും.	529843	He can run faster than me.
711691	അവൻ ഒരു നല്ല മനുഷ്യനാണ്.	303816	He is a nice person.
711693	അവൻ അവിടെ പോയോ?	290445	Did he go there?
711698	ഞാൻ അതിനെക്കുറിച്ച് ആലോചിക്കാം.	31268	I'll think about it.
711699	എനിക്ക് ചെറിയ കവിതകൾ ഇഷ്ടമാണ്.	259390	I like short poems.
714232	അശ്രദ്ധ മൂലമാണ് കാട്ടുതീ ഉണ്ടായത്.	47704	The forest fire occurred through carelessness.
714248	അവൾക്കിതു വരെ ഒരു സൈക്കിൾ ഓടിക്കാൻ അറിയില്ല.	312234	She can't ride a bicycle yet.
714254	ജോൺ അവന്റെ പുതിയ വീടിനെക്കുറിച്ച് വളരെയധികം അഭിമാനിക്കുന്നു.	52525	John is very proud of his new house.
716617	അവന് തെറ്റ് വരുത്താതെ ഇംഗ്ലീഷ് എഴുതാൻ സാധിക്കില്ല.	294028	He cannot write English without making mistakes.
716619	അപരിചിതമായ ശബ്ദം കേട്ട പൂച്ച ഭയന്നു.	44552	The cat was scared by an unfamiliar noise.
716621	ഇതെന്റെ കുടയല്ല, വേറാരുടെയോ ആണ്.	55619	This isn't my umbrella; it's somebody else's.
